{
  "$schema": "../schemas/dco-policy.schema.json",
  "schemaVersion": 1,
  "status": "operational",
  "repository": "lunifans/rinspace-web",
  "documents": {
    "dco": {
      "path": "DCO",
      "version": "1.1",
      "sha256": "b31b768eae6c738027c51a83100a205a216ce3e900515d593920e66c5a6f83f6"
    },
    "contributionLicense": {
      "path": "CONTRIBUTION-LICENSE.md",
      "version": "1.0",
      "spdxIdentifier": "Apache-2.0",
      "sha256": "b0581ce190d1d8df18f4752a728809008fa3396f2b87631fc9db10ae2e565a82"
    }
  },
  "signoffPolicy": {
    "requireEveryCommitAuthor": true,
    "requireEveryCoauthor": true,
    "identityMatch": "name-and-email-case-insensitive",
    "allowGitHubNoreplyEmail": true
  },
  "botExemptions": [
    {
      "githubLogin": "dependabot[bot]",
      "githubUserId": "49699333",
      "reason": "GitHub-operated dependency update bot; changes remain subject to review and all other CI gates.",
      "approvedBy": "任务优先（上海）网络科技有限责任公司",
      "approvedAt": "2026-09-04T19:03:07+08:00"
    }
  ],
  "largeOrCorporateContributions": {
    "threshold": "maintainer-discretion-for-ownership-complexity-size-or-patent-risk",
    "action": "separate-written-agreement-before-merge"
  },
  "blockers": []
}
